{
  "Version": 3,
  "UniqueID": "Viola_Player",
  "DisplayName": "Viola - Main Outfit [Costume Base]",
  "PresetName": "Viola",
  "PresetVariant": "Main Outfit",
  "Type": "Costume",
  "TargetCharacterID": "Viola",
  "Requirements": [
    "None"
  ],
  "PhysicsAssetPath": "/Game/Art/Character/Player/DS_Viola/Meshs/ch_viola_body_mesh_PhysicsAsset.ch_viola_body_mesh_PhysicsAsset",
  "PhysicsAnimBlueprintPath": "/Game/Design/DsCharacter/DsPhysics/PC/Viola/DsABP_Viola_Physics.DsABP_Viola_Physics_C",
  "FaceMorphPath": "/Game/Art/Character/Player/DS_Viola/Meshs/ch_viola_ingame_face_mesh.ch_viola_ingame_face_mesh",
  "FacePath": "/Game/Art/Character/Player/DS_Viola/Meshs/ch_viola_face_mesh.ch_viola_face_mesh",
  "FaceClearMaterialOverrides": true,
  "FaceMaterials": [
    {
      "SlotIndex": 0,
      "MaterialPath": "/Game/Art/Character/Player/DS_Viola/Materials/ch_viola_face_mi.ch_viola_face_mi"
    },
    {
      "SlotIndex": 1,
      "MaterialPath": "/Game/Art/Character/Player/DS_Viola/Materials/ch_viola_eye_mi.ch_viola_eye_mi"
    }
  ],
  "FaceMorphTargets": [],
  "BodyPath": "/Game/Art/Character/Player/DS_Viola/Meshs/ch_viola_body_mesh.ch_viola_body_mesh",
  "BodyClearMaterialOverrides": true,
  "BodyMaterials": [
    {
      "SlotIndex": 0,
      "MaterialPath": "/Game/Art/Character/Player/DS_Viola/Materials/ch_viola_top_mi.ch_viola_top_mi"
    },
    {
      "SlotIndex": 1,
      "MaterialPath": "/Game/Art/Character/Player/DS_Viola/Materials/ch_viola_top_skin_mi.ch_viola_top_skin_mi"
    },
    {
      "SlotIndex": 2,
      "MaterialPath": "/Game/Art/Character/Player/DS_Viola/Materials/ch_viola_bot_mi.ch_viola_bot_mi"
    },
    {
      "SlotIndex": 3,
      "MaterialPath": "/Game/Art/Character/Player/DS_Viola/Materials/ch_viola_bot_skin_mi.ch_viola_bot_skin_mi"
    },
    {
      "SlotIndex": 4,
      "MaterialPath": "/Game/Art/Character/Player/DS_Viola/Materials/ch_viola_hair_mi.ch_viola_hair_mi"
    },
    {
      "SlotIndex": 5,
      "MaterialPath": "/Game/Art/Character/Player/DS_Viola/Materials/ch_viola_hair_metal_mi.ch_viola_hair_metal_mi"
    }
  ],
  "BodyMorphTargets": [],
  "CharacterIconPath": "/Game/MODS/HoverModsVault/DSDataBase/UI/Characters/Default_Costume.Default_Costume"
}
