{
  "Version": 3,
  "UniqueID": "Astria_costume_swimsuit01_dlc",
  "DisplayName": "Astria - Coral Summer Mischief [Costume DLC]",
  "PresetName": "Astria",
  "PresetVariant": "Coral Summer Mischief",
  "Type": "Costume",
  "TargetCharacterID": "Astria",
  "Requirements": ["AstriaDLC"],

  "PhysicsAssetPath": "/Game/Art/Character/Costume/DS_Astria/Astira_swimsuit_01/Mesh/ch_Astria_swimsuit_01_body_mesh_PhysicsAsset.ch_Astria_swimsuit_01_body_mesh_PhysicsAsset",
  "PhysicsAnimBlueprintPath": "/Game/Design/DsCharacter/DsPhysics/PC/Astria/DsABP_Astria_SwimSuit_Physics.DsABP_Astria_SwimSuit_Physics_C",

  "FaceMorphPath": "/Game/Art/Character/Player/DS_Astria/Meshs/ch_Astria_ingame_face_mesh.ch_Astria_ingame_face_mesh",
  "FacePath": "/Game/Art/Character/Player/DS_Astria/Meshs/ch_Astria_mesh_face.ch_Astria_mesh_face",
  "FaceClearMaterialOverrides": true,
  "FaceMaterials": [
    {
      "SlotIndex": 0,
      "MaterialPath": "/Game/Art/Character/Costume/DS_Astria/Astira_swimsuit_01/Materials/ch_Astria_swimsuit_01_face_mi.ch_Astria_swimsuit_01_face_mi"
    },
    {
      "SlotIndex": 1,
      "MaterialPath": "/Game/Art/Character/Costume/DS_Astria/Astira_swimsuit_01/Materials/ch_Astria_swimsuit_01_eye_mi.ch_Astria_swimsuit_01_eye_mi"
    }
  ],
  "FaceMorphTargets": [
    {
      "MorphName": "swimsuit_01",
      "Value": 1.0,
      "Description": "Fixed face morph required by Astria Swimsuit 01.",
      "Locked": true
    }
  ],

  "BodyPath": "/Game/Art/Character/Costume/DS_Astria/Astira_swimsuit_01/Mesh/ch_Astria_swimsuit_01_body_mesh.ch_Astria_swimsuit_01_body_mesh",
  "BodyClearMaterialOverrides": true,
  "BodyMaterials": [
    {
      "SlotIndex": 0,
      "MaterialPath": "/Game/Art/Character/Costume/DS_Astria/Astira_swimsuit_01/Materials/ch_Astria_swimsuit_01_body_mi.ch_Astria_swimsuit_01_body_mi"
    },
    {
      "SlotIndex": 1,
      "MaterialPath": "/Game/Art/Character/Costume/DS_Astria/Astira_swimsuit_01/Materials/ch_Astria_swimsuit_01_skin_mi.ch_Astria_swimsuit_01_skin_mi"
    },
    {
      "SlotIndex": 2,
      "MaterialPath": "/Game/Art/Character/Costume/DS_Astria/Astira_swimsuit_01/Materials/ch_Astria_swimsuit_01_hair_sdw.ch_Astria_swimsuit_01_hair_sdw"
    },
    {
      "SlotIndex": 3,
      "MaterialPath": "/Game/Art/Character/Costume/DS_Astria/Astira_swimsuit_01/Materials/ch_Astria_swimsuit_01_grass_mi.ch_Astria_swimsuit_01_grass_mi"
    },
    {
      "SlotIndex": 4,
      "MaterialPath": "/Game/Art/Character/Costume/DS_Astria/Astira_swimsuit_01/Materials/ch_Astria_swimsuit_01_hair_mi.ch_Astria_swimsuit_01_hair_mi"
    }
  ],
  "BodyMorphTargets": [],

  "CharacterIconPath": "/Game/MODS/HoverModsVault/DSDataBase/UI/Characters/DLC/Img_Character_Signal_Astria_Unique_01.Img_Character_Signal_Astria_Unique_01"
}
