{
  "Version": 3,
  "UniqueID": "Aileen_Player",
  "DisplayName": "Eileen - Main Outfit [Costume Base]",
  "PresetName": "Eileen",
  "PresetVariant": "Main Outfit",
  "Type": "Costume",
  "TargetCharacterID": "Aileen",
  "Requirements": [
    "None"
  ],
  "PhysicsAssetPath": "/Game/Art/Character/Player/DS_Aileen/Meshs/ch_aileen_mesh_body_PhysicsAsset.ch_aileen_mesh_body_PhysicsAsset",
  "PhysicsAnimBlueprintPath": "/Game/Design/DsCharacter/DsPhysics/PC/Aileen/DsABP_Aileen_Physics.DsABP_Aileen_Physics_C",
  "FaceMorphPath": "/Game/Art/Character/Player/DS_Aileen/Meshs/ch_aileen_ingame_face_mesh.ch_aileen_ingame_face_mesh",
  "FacePath": "/Game/Art/Character/Player/DS_Aileen/Meshs/ch_aileen_face_mesh.ch_aileen_face_mesh",
  "FaceClearMaterialOverrides": true,
  "FaceMaterials": [
    {
      "SlotIndex": 0,
      "MaterialPath": "/Game/Art/Character/Player/DS_Aileen/Materials/ch_aileen_face_mi.ch_aileen_face_mi"
    },
    {
      "SlotIndex": 1,
      "MaterialPath": "/Game/Art/Character/Player/DS_Aileen/Materials/ch_aileen_eye_mi.ch_aileen_eye_mi"
    }
  ],
  "FaceMorphTargets": [],
  "BodyPath": "/Game/Art/Character/Player/DS_Aileen/Meshs/ch_aileen_mesh_body.ch_aileen_mesh_body",
  "BodyClearMaterialOverrides": true,
  "BodyMaterials": [
    {
      "SlotIndex": 0,
      "MaterialPath": "/Game/Art/Character/Player/DS_Aileen/Materials/ch_aileen_top_mi.ch_aileen_top_mi"
    },
    {
      "SlotIndex": 1,
      "MaterialPath": "/Game/Art/Character/Player/DS_Aileen/Materials/ch_aileen_skin_mi.ch_aileen_skin_mi"
    },
    {
      "SlotIndex": 2,
      "MaterialPath": "/Game/Art/Character/Player/DS_Aileen/Materials/ch_aileen_bot_mi.ch_aileen_bot_mi"
    },
    {
      "SlotIndex": 3,
      "MaterialPath": "/Game/Art/Character/Player/DS_Aileen/Materials/ch_aileen_hair_mi.ch_aileen_hair_mi"
    }
  ],
  "BodyMorphTargets": [],
  "CharacterIconPath": "/Game/MODS/HoverModsVault/DSDataBase/UI/Characters/Img_Character_Signal_Eileen.Img_Character_Signal_Eileen"
}
